{
  "version": 1,
  "scene_sha256": "0000000000000000000000000000000000000000000000000000000000000000",
  "layout_sha256": "0000000000000000000000000000000000000000000000000000000000000000",
  "neutral_sha256": "0000000000000000000000000000000000000000000000000000000000000000",
  "neutral_file": "neutral_v1.json",
  "interpolation_delay_s": 0.06666666666666667,
  "clock": {
    "drift_bound_ppm": null,
    "max_echo_age_s": 2,
    "evidence_sha256": null
  }
}
